{
  "algorithm": "logistic",
  "hyperparameters": {},
  "feature_importance": [
    [
      "obv_sma_20",
      1.3515267353234826
    ],
    [
      "price_vwap_ratio",
      1.115316502071904
    ],
    [
      "momentum_20",
      0.8809228541717108
    ],
    [
      "obv",
      0.8364070154403213
    ],
    [
      "momentum_10",
      0.753716114389079
    ],
    [
      "atr_14",
      0.6999889229969172
    ],
    [
      "hvol_5",
      0.635217808824083
    ],
    [
      "vwap_20",
      0.6132754041468206
    ],
    [
      "quarter",
      0.5646139134497117
    ],
    [
      "roc_10",
      0.5554928535818313
    ],
    [
      "return_10d",
      0.555492853581809
    ],
    [
      "bb_width",
      0.5449216234518449
    ],
    [
      "minus_di",
      0.5022854509125072
    ],
    [
      "kc_width",
      0.43622019462555994
    ],
    [
      "atr_percent",
      0.43622019462555994
    ],
    [
      "hvol_ratio_5_20",
      0.40299551232026426
    ],
    [
      "vol_ratio_20",
      0.3967414533598821
    ],
    [
      "bb_position",
      0.3709468778679586
    ],
    [
      "sma_10",
      0.36338316673618076
    ],
    [
      "sma20_sma50_ratio",
      0.32637789603896605
    ]
  ],
  "calibration_method": "platt"
}